{
 "id": "emoji",
 "label": "Emoji",
 "version": "0.1.0",
 "provenance": {
  "author": "PocketRPG",
  "license": "Unicode emoji; placeholder selection, to be curated"
 },
 "modifiers": {},
 "entries": [
  {
   "v": "🗝️"
  },
  {
   "v": "🕯️"
  },
  {
   "v": "🗺️"
  },
  {
   "v": "⚔️"
  },
  {
   "v": "🛡️"
  },
  {
   "v": "🏹"
  },
  {
   "v": "🔮"
  },
  {
   "v": "📜"
  },
  {
   "v": "💀"
  },
  {
   "v": "🐉"
  },
  {
   "v": "🦉"
  },
  {
   "v": "🐺"
  },
  {
   "v": "🐍"
  },
  {
   "v": "🦇"
  },
  {
   "v": "🕷️"
  },
  {
   "v": "🌙"
  },
  {
   "v": "☀️"
  },
  {
   "v": "⭐"
  },
  {
   "v": "🌊"
  },
  {
   "v": "🔥"
  },
  {
   "v": "⛈️"
  },
  {
   "v": "🌲"
  },
  {
   "v": "🏔️"
  },
  {
   "v": "🏰"
  },
  {
   "v": "⛪"
  },
  {
   "v": "🏚️"
  },
  {
   "v": "🚪"
  },
  {
   "v": "🪜"
  },
  {
   "v": "⚓"
  },
  {
   "v": "🚂"
  },
  {
   "v": "🚀"
  },
  {
   "v": "🛸"
  },
  {
   "v": "🤖"
  },
  {
   "v": "👑"
  },
  {
   "v": "💍"
  },
  {
   "v": "💰"
  },
  {
   "v": "🎭"
  },
  {
   "v": "🎲"
  },
  {
   "v": "🃏"
  },
  {
   "v": "🧭"
  },
  {
   "v": "⏳"
  },
  {
   "v": "⚖️"
  },
  {
   "v": "🔒"
  },
  {
   "v": "🩸"
  },
  {
   "v": "🌹"
  },
  {
   "v": "🍷"
  },
  {
   "v": "🍞"
  },
  {
   "v": "🐎"
  },
  {
   "v": "🧪"
  },
  {
   "v": "📯"
  },
  {
   "v": "🪦"
  },
  {
   "v": "👁️"
  },
  {
   "v": "🗡️"
  },
  {
   "v": "🎻"
  },
  {
   "v": "🪞"
  },
  {
   "v": "🧶"
  }
 ]
}
