{
 "id": "emotions",
 "label": "Emotions",
 "version": "0.2.0",
 "provenance": {
  "author": "PocketRPG",
  "license": "original entries"
 },
 "modifiers": {},
 "entries": [
  {
   "v": "sad"
  },
  {
   "v": "happy"
  },
  {
   "v": "delighted"
  },
  {
   "v": "frustrated"
  },
  {
   "v": "humiliated"
  },
  {
   "v": "weary"
  },
  {
   "v": "anxious"
  },
  {
   "v": "smug"
  },
  {
   "v": "furious"
  },
  {
   "v": "giddy"
  },
  {
   "v": "suspicious"
  },
  {
   "v": "grieving"
  },
  {
   "v": "hopeful"
  },
  {
   "v": "bored"
  },
  {
   "v": "terrified"
  },
  {
   "v": "embarrassed"
  },
  {
   "v": "proud"
  },
  {
   "v": "resentful"
  },
  {
   "v": "lonely"
  },
  {
   "v": "relieved"
  },
  {
   "v": "curious"
  },
  {
   "v": "guilty"
  },
  {
   "v": "jealous"
  },
  {
   "v": "bitter"
  },
  {
   "v": "content"
  },
  {
   "v": "nervous"
  },
  {
   "v": "impatient"
  },
  {
   "v": "ashamed"
  },
  {
   "v": "amused"
  },
  {
   "v": "homesick"
  },
  {
   "v": "defiant"
  },
  {
   "v": "desperate"
  },
  {
   "v": "wistful"
  },
  {
   "v": "overjoyed"
  },
  {
   "v": "betrayed"
  },
  {
   "v": "calm"
  },
  {
   "v": "panicked"
  },
  {
   "v": "stubborn"
  },
  {
   "v": "grateful"
  },
  {
   "v": "sheepish"
  },
  {
   "v": "irritated",
   "src": "ai"
  },
  {
   "v": "joyful",
   "src": "ai"
  },
  {
   "v": "melancholy",
   "src": "ai"
  },
  {
   "v": "envious",
   "src": "ai"
  },
  {
   "v": "eager",
   "src": "ai"
  },
  {
   "v": "apprehensive",
   "src": "ai"
  },
  {
   "v": "disgusted",
   "src": "ai"
  },
  {
   "v": "lovesick",
   "src": "ai"
  },
  {
   "v": "restless",
   "src": "ai"
  },
  {
   "v": "smitten",
   "src": "ai"
  },
  {
   "v": "flustered",
   "src": "ai"
  },
  {
   "v": "indignant",
   "src": "ai"
  },
  {
   "v": "mournful",
   "src": "ai"
  },
  {
   "v": "serene",
   "src": "ai"
  },
  {
   "v": "skeptical",
   "src": "ai"
  },
  {
   "v": "thrilled",
   "src": "ai"
  },
  {
   "v": "uneasy",
   "src": "ai"
  },
  {
   "v": "vengeful",
   "src": "ai"
  },
  {
   "v": "wary",
   "src": "ai"
  },
  {
   "v": "zealous",
   "src": "ai"
  },
  {
   "v": "awestruck",
   "src": "ai"
  },
  {
   "v": "bewildered",
   "src": "ai"
  },
  {
   "v": "cheerful",
   "src": "ai"
  },
  {
   "v": "dejected",
   "src": "ai"
  },
  {
   "v": "elated",
   "src": "ai"
  },
  {
   "v": "exasperated",
   "src": "ai"
  },
  {
   "v": "forlorn",
   "src": "ai"
  },
  {
   "v": "grumpy",
   "src": "ai"
  },
  {
   "v": "hesitant",
   "src": "ai"
  },
  {
   "v": "insecure",
   "src": "ai"
  },
  {
   "v": "nostalgic",
   "src": "ai"
  },
  {
   "v": "overwhelmed",
   "src": "ai"
  },
  {
   "v": "pensive",
   "src": "ai"
  },
  {
   "v": "regretful",
   "src": "ai"
  },
  {
   "v": "tender",
   "src": "ai"
  },
  {
   "v": "tormented",
   "src": "ai"
  },
  {
   "v": "triumphant",
   "src": "ai"
  },
  {
   "v": "apathetic",
   "src": "ai"
  },
  {
   "v": "enraged",
   "src": "ai"
  },
  {
   "v": "determined",
   "src": "ai"
  }
 ]
}
